{
  "schema": "ygg.web-search.presentation-fixture.v1",
  "extension": "ygg-web-search",
  "case": "reconnect_without_refetch",
  "retained_snapshot": {
    "generation": 7,
    "snapshot": {
      "revision": 4,
      "status": {
        "state": "active",
        "label": "web · SearXNG"
      },
      "activities": [
        {
          "id": "web:web_search:42",
          "kind": "web_retrieval",
          "state": "succeeded",
          "summary": "web_search · SearXNG · 2 results · 1840 bytes · cache hit · 4 ms · ok",
          "provenance": "SearXNG",
          "started_at_ms": 1000,
          "completed_at_ms": 1124,
          "references": []
        }
      ],
      "collection": {
        "kind": "list",
        "title": "2 web citations",
        "nodes": [
          {
            "id": "web-1000000000000001",
            "state": "active",
            "label": "Example research result",
            "secondary": "https://example.com · 2026-08-20",
            "action_ids": [],
            "references": [
              {
                "kind": "url",
                "id": "https://example.com/research",
                "label": "https://example.com"
              }
            ]
          },
          {
            "id": "web-2000000000000002",
            "state": "active",
            "label": "Second source",
            "secondary": "https://docs.example.org",
            "action_ids": [],
            "references": [
              {
                "kind": "url",
                "id": "https://docs.example.org/source",
                "label": "https://docs.example.org"
              }
            ]
          }
        ],
        "selected_node_id": "web-1000000000000001",
        "detail": {
          "node_id": "web-1000000000000001",
          "title": "Example research result",
          "body": "Citation: web-1000000000000001\nOrigin: https://example.com\nURL: https://example.com/research\nPublished: 2026-08-20",
          "references": [
            {
              "kind": "url",
              "id": "https://example.com/research",
              "label": "https://example.com"
            }
          ]
        }
      },
      "actions": []
    }
  },
  "notifications": [],
  "expected_snapshot": {
    "revision": 4,
    "status": {
      "state": "active",
      "label": "web · SearXNG"
    },
    "activities": [
      {
        "id": "web:web_search:42",
        "kind": "web_retrieval",
        "state": "succeeded",
        "summary": "web_search · SearXNG · 2 results · 1840 bytes · cache hit · 4 ms · ok",
        "provenance": "SearXNG",
        "started_at_ms": 1000,
        "completed_at_ms": 1124,
        "references": []
      }
    ],
    "collection": {
      "kind": "list",
      "title": "2 web citations",
      "nodes": [
        {
          "id": "web-1000000000000001",
          "state": "active",
          "label": "Example research result",
          "secondary": "https://example.com · 2026-08-20",
          "action_ids": [],
          "references": [
            {
              "kind": "url",
              "id": "https://example.com/research",
              "label": "https://example.com"
            }
          ]
        },
        {
          "id": "web-2000000000000002",
          "state": "active",
          "label": "Second source",
          "secondary": "https://docs.example.org",
          "action_ids": [],
          "references": [
            {
              "kind": "url",
              "id": "https://docs.example.org/source",
              "label": "https://docs.example.org"
            }
          ]
        }
      ],
      "selected_node_id": "web-1000000000000001",
      "detail": {
        "node_id": "web-1000000000000001",
        "title": "Example research result",
        "body": "Citation: web-1000000000000001\nOrigin: https://example.com\nURL: https://example.com/research\nPublished: 2026-08-20",
        "references": [
          {
            "kind": "url",
            "id": "https://example.com/research",
            "label": "https://example.com"
          }
        ]
      }
    },
    "actions": []
  },
  "expected_network_requests": 0
}
